{
  "project": "pathologic2-marble-nest",
  "projectDisplayName": "Pathologic 2: Marble Nest",
  "generatedAt": "2025-10-20T13:32:00Z",
  "inputHash": "8f4c3d9...",
  "suggestions": [
    {
      "segmentId": "conv:6192355001750781",
      "tokens": ["Executor"],
      "candidates": [
        {
          "conceptId": "wiki:executor",
          "source": "https://pathologic.fandom.com/wiki/Executor",
          "confidence": 0.95,
          "notes": "Exact token match for \"Executor\""
        },
        {
          "conceptId": "wiki:death",
          "source": "https://pathologic.fandom.com/wiki/Death",
          "confidence": 0.66,
          "notes": "Token appears within \"Death\" title"
        }
      ]
    }
  ]
}
